"title","username","date","stars","content"
"Marvels","drawlife","8 November 2023",510,"THE MARVELS is here and it's a mashed up film that is totally all over the place. It feels as if this film was edited and chopped into pieces during post and it shows.Couple things I enjoyed, I did like seeing Carol Danvers and Monica Rambeau resolve and acknowledge their relationship, but due to the nature of their characters being straight arrows, it allows Iman Vellani's Kamala Khan to be the audience just as Tom Holland's Peter Parker was in CIVIL WAR. I did not particularly enjoy the MS. MARVEL series, but I can see her being the shoutout for many.I think the script just touched on the surface of Brie Larson's Captain Marvel herself, so diving into her more is a plus, however the story did her no favors once again and I did feel like she was given like four or five pieces of direction to portray her character compared to the more one-note performance in the first film. Teyonah Parris is commendable. She was the more science-y of the trio.Samuel L. Jackson just feels inconsistent especially after SECRET INVASION. Feels like this Nick Fury is a variant. He's simply passing through in this film.Another thing I liked was the incursions (also briefly touched on in DOCTOR STRANGE IN THE MULTIVERSE OF MADNESS). We all complained about the lack of planting seeds for the future leading into KANG DYNASTY and SECRET WARS. Finally, this film it at least preps and teases what's to come down the line.The MCU's villain problem is a long known fact, but here it only cements their problem even further. Now I'm a fan of Lee Pace's over the top performance as Ronan, but Dar-Benn played by Zawe Ashton is literally a copy and paste of Ronan, but female. Nothing new about it. Definitely up there as one of the worst villains in the MCU.The power swaps were kinda cool so I can give it that. Nia DaCosta does a good job executing the fight scenes, but again as one should expect, VFX is meh. Now if you cringed during the musical note duel between the two Doctor Strange, then wait till you see one segment of the film where it feels like a misplaced musical. Lots of quirky and annoying humor like one should expect in an MCU film.The Skrulls are in the film and as a fan we always think we can write the better film after watching it, but I just DO NOT understand why this sequel couldn't have been SECRET INVASION(one of the worst MCU Disney+ shows). SECRET INVASION honestly should have been an Avengers film or at the very least a Captain Marvel sequel co-starring some Avengers, kinda like CIVIL WAR. I personally feel like that dilemma could have furthered Captain Marvel's development due to her involvement with them and how she's equally to blame for not helping them out when she and Fury promised to find them a home. But instead she's stuck with this material.The mid-credit scene is arguably the best part. Once again teasing things to come. It's stuff that like that, that will maybe still garner interest in the MCU despite its current fall from grace. The end-credit scene is alright. Not particularly jazzed about that promise down the line.On that note, the recent Variety article published about Marvel Studios talked about their behind the scenes trouble. It was said that Kevin Feige and his creative committee partook in their yearly Palm Springs retreat to regroup and refocus, so here's hoping to next year being more consistent with quality. Seemed like he was spread too thin with the mandate to have more quantity than quality.THE MARVELS is a season 1.5 for MS. MARVEL and a CAPTAIN MARVEL sequel that we never saw due to the flashbacks and exposition to explain things. And let's be clear, at this point everything feels like homework. That was going to be inevitable moving forward after INFINITY WAR and ENDGAMGE, but especially when Disney+ was announced making Kevin Feige spread out too thin. But it only feels like homework because everything that has been released is below the standard of what Marvel set up for us.So to sum it up, while I did find it slightly more appealing than the first CAPTAIN MARVEL and QUANTUMANIA, that isn't saying much. Low expectations definitely helped. Is THE MARVELS one of the worst? No, but it definitely belongs way down below the list.5/10."
"Marvels","tibby_23","17 January 2024",410,"By far the worst Marvel movie so far, I am extremely disappointed. After the mess that Thor 4 was, I was hoping that Marvel learned its lesson, but it seems not. I am honestly happy this movie did bad at the box office, that's what you get for ruining such a great character (I loved Cpt. Marvel from the comics).What makes it bad:
Action moves way too fast from one scene to anotherNo character improvement or growth by the end of the movieThings just happen with no storytellingNot serious enough, too childish for my tasteToo many goofy moments (singing, really? We've come this low, Marvel?)End scenes that try to set the context for next movies seem forced and unnecessaryI also found two good things eventually:
I liked the villain and her story, sympathized with her a bitAt least the movie was not long.These writers should never be hired again."
"Marvels","olcare","10 November 2023",410,"Criticizing specific parts of the movie became confusing for me as there were so many details I wanted to change. This film truly disappointed me, especially since my expectations were already low, and falling below them is a bad sign for Marvel. It had a Thor: Love and Thunder vibe, which I also disliked (4/10). I had been excited after watching Loki in the morning, but it was in vain.For me, the unbearable part was the music. After checking the playlists of movies I've watched for a long time, Marvel had by far the worst compositions. The music was exaggerated, drowning out the impact of fight scenes and making them unbearable. It was like overly noisy background music during a break.Another aspect I didn't like was the main villain. I can't believe Marvel fell into the same mistake again. The villain was poorly written, and Zawe Ashton's performance felt forced, appearing awkward in scenes. One major reason for this was the poor portrayal of the Kree Empire in the MCU. Neglecting the significance of the Kree made Supreme look bad. They could have explained the critical situation of the 'Hala' planet in the film's opening with a 30-35 minute sequence, providing context for the desperation of the Kree.Another thing I found absurd was Monica teleporting to a parallel universe. They portrayed the concept of parallel universes like child's play. Especially after watching Loki Season 2 in the morning, her randomly teleporting or getting stuck in another universe seemed too simplistic.Seeing Professor Beast was surprising and pleasing. The X-Men era is beginning, and despite the poor productions, I'm excited. Brie Larson was good again, carrying her character well. The scene with Monica, Kamala, Danvers vs Dar-Benn was good, thankfully without music. However, despite not being a fan of Kamala Khan, her origin is preserved, and it's not bad. But I feel there's a lack of harmony among our main three characters, and I believe it's a script issue, not an actor one.While I like the idea of saving a planet by traveling through different planets, I didn't like the execution at all. Presenting such a serious and contemporary issue as if it's the simplest thing with childlike music seems somewhat unserious to me.However it turns out, this film paved the way for others and served as a stepping stone. Hopefully, with Beast in Deadpool 3, the overall MCU storyline will improve, abandoning mediocrity urgently; otherwise, it will continue to receive poor ratings.Note: I forgot to mention in the review, but Goose is a fantastic character, and I hope we continue to see this adorable cat. The scene with all the cats was genuinely entertaining, one of the enjoyable moments in 4-5 scenes."
"Marvels","alensufli","8 November 2023",210,"Even writing a review is extremely pointless as we all knew what we were expecting months before but here I am. They even themselves admitted it. The film is a huge disappointment. The plot is all over the place. Actions sequences were sometimes good but sometime were so dumb I didn't know where to look, where to pay attention. I like how they tried to catch the old marvel magic. Yes. They tried. But they utterly failed. Feige pulled off ""wait until the post credit scene to get excited cuz the film itself is boring"" trick again. And it wasn't a ""wow"" for me at least. The theatre was silent throughout and after the film. No one even made a giggling sound. Dead silence. Jokes were landing facedown to the ground every time a character made one. That's right. Every character there is comic relief. And I absolutely don't wanna talk about acting."
"Marvels","S3pt3m63r","18 November 2023",NA,"Unfortunately if you haven't got Disney plus and you don't keep to speed with the tv series, then you this movie won't make much sense as it relies on you knowing what's going on in that universe so far, which I'm not up to date with and involves the Miss Marvels characters which haven't been introduced in the movies. Confusing.I had hoped that following Guardians 3 it could've get much worse for the Marvel universe, at least Guardians has Rocket😂It's hard to find any plot to this movie. Carol Danvers (Captain Marvel) does throw a lot of people through the roof but the plot is a quantum entanglement mess. The movie is blissfully short but feels longer as it's so bad and some people walked out of the theatre. I was so pleasantly when it ended.I think it's about to retire the whole Marvel superhero franchise as this phase is going badly."
"Marvels","nscoby93","10 November 2023",210,"I actually had no intention of watching this film in theaters. Originally, I was just going to wait for its home release on Disney Plus, but after recently rewatching WandaVision, I genuinely wanted to see how they would handle Monica Rambeau and see what they would do with her.So I'll mention the positives for this film first...The movie is actually pretty, I really enjoyed the film aesthetically it looked good. This is very surprising to say as recent Marvel projects are tremendous eye sores.The films central characters, Captain Marvel (Brie Larson) Monica Rambeau (Teyonah Parris) and Kamala Khan (Iman Vellani), were surprisingly good. I had fully anticipated to dislike Captain Marvel and Ms Marvel in this film but I surprisingly enjoyed them both which is a big compliment coming from me, and Monica Rambeau is my favorite of the three she was good as I expected and anticipated. All three actresses gave enjoyable performances, and they all worked well together on screen.Then, of course, Samuel Jackson is always great! And the return of everyone's favorite Flerken kitty Goose. She had a great sequence that I refuse to spoil, but it had me dying. Goose saved this film!And well that's it...This film is just bad. Bad writing, bad pacing, bad storytelling. Nothing in this film is properly set up as it rushes through its 1 hour and 45 minute run time. Which is quite frankly fine for me as I genuinely did not want more of this.This movie as a whole is just overwhelmingly safe. It has no stakes, takes no risks, and does nothing. But there is actual enjoyment in its failings. It was so bad that it was good. The amount of eye rolling, face palms, and sighs I gave through this film was astonishing. I gave up on this film within the first 30 minutes, and afterward, that's when the enjoyment began because of how bad it went on to be.Then suddenly, out of nowhere, the film became a musical? Like what is happening? This film is so chaotic and unstructured. It just never stopped.The film had a good mid-credit scene so you know stay for that. Unfortunately, it was spoiled for me, so it didn't hit as hard as it could have. Especially if you're a fan of the actor who originally played the character the scene introduces.But The Marvels was exactly what I anticipated it to be, a below average dump. Which is a shame because they play with some interesting concepts in this film, but they do nothing with them, or they are just poorly handled. I can at least say I didn't hate this movie. Unfortunately, I just enjoyed it for all the wrong reasons.IMDb: 3/10
Letterboxd: 2/5Watched in Theaters."
"Marvels","Rabid_dog-sr","6 February 2024",810,"This is a fun movie, it ties two TV shows into the lore and does a good job of having fun.Does it add anything to the overall Narative, no!Does it highight Ms Marvel as a fun addition, hell yes. Once you get over its not adding anything or revealing any easter eggs, you can enjoy it for what it is.All three main characters deliver on their role, and it improves on captain marvels solo outing. Sit down take any preconceived ideas you have, remove any anticipation of easter eggs and enjoy it for what it is.Has marvel lost its way, yes. Have the glorious days of intertwined writing and on screen narrative been left behind, yes, but as a movie its fun."
"Marvels","brentsbulletinboard","11 November 2023",510,"When I first heard the title of this movie, I thought it was about a 1960s girls' singing group. And, frankly, that would have probably made for a better movie. Writer-director Nia DaCosta's third feature outing and the latest in the Marvel Universe paradigm is a wildly inconsistent superhero movie that tries too hard to do too much and doesn't have a script to support it. Too many of its plot elements aren't adequately explained until well into the story, while others aren't explained at all, leaving viewers who aren't comic book laureates wondering what's going on (particularly at film's end). Meanwhile, other narrative aspects frequently appear gimmicky and grow old quickly, such as the introduction of the primary superpower that its three protagonists share, one that almost becomes slapstickish after an all-too-brief while. On top of that, the CGI effects vacillate from one end of the quality spectrum to the other, creating a mix of images that are either startling to look at or stunningly cheesy at best. Add to that a villain that isn't particularly menacing, along with attempts at humor that either succeed brilliantly (cat lovers take note) or fall flat and look incredibly lame (as aficionados of musical theater will undoubtedly attest), all of which further add to the picture's pervasive inconsistency. The inclusion of ample clues for advancing the overarching Marvel Universe storyline continues here, too, furthering a trend that's growing tiresome in the studio's releases, a development akin to the ""Paul is dead"" legacy come to life with every passing picture. Then there's the trio of heroes themselves, who often appear more like they've been plucked from a giddy slumber party flick or a Cyndi Lauper video than taking center stage as seriously empowered champions in an action-adventure offering. All of these failings combine to make this production more of a forgettable placeholder in the Marvel mythology than a standalone feature (not to mention a pale substitute for a sequel to the far-superior film that launched the Captain Marvel franchise in 2019). In short, ""The Marvels"" is as much of a mess as it is a movie, and that's troubling for several reasons. It lends credence to the growing criticism that films like this aren't to be taken seriously. It reinforces the notion that they're cookie-cutter in nature, easily interchangeable with one another. And it raises questions about the career choices of lead actress Brie Larson, who, though quite capable of playing roles like these, is running the risk of becoming type-cast, a troubling prospect for an Academy Award-winning actress who possesses a depth of talent and is handily adept at taking on better and more serious material than this. In the wake of this release, Marvel Studios should take a step back and seriously assess where its future is headed, especially if movies like this are any indication. As pictures like ""Wakanda Forever"" (2022) show, the studio is capable of better work - and it's time to show viewers that."
"Marvels","Sleepin_Dragon","10 November 2023",410,"Carol Danvers is attempting to save the universe, but her incredible powers become entangled with those of Kamala Khan and Monica Rambeau, they must unite to save the world.Ouch, what can you say, this is surely one of Marvel's lowest points, I honestly don't know who the target audience is, or who this is going to appeal to, young teens only maybe? Anyhow, this was an absolute mess.The writing was clearly problematic, it doesn't gel, it is genuinely all over the place. I do very much wonder if huge sections of this film cut? It can be the only answer, it just doesn't flow at all, and that short run time...Special effects, some were pretty good, some were poor, I just wish there was a greater focus on plot, it just seemed like 100 minutes of CGI, noise and random events.Brie Larson, I'm not sure about you, but to me she looked totally disinterested and bored by the whole thing, what I didn't see, was someone committed to the role. I thought Samuel Jackson was rather good, but again poorly served by the script.It didn't look great from the trailers, and in reality, it's another clunker from Marvel Studios.4/10."
"Marvels","judywalker2","14 December 2023",510,"Went to see this movie with my 17- and 11-year-old granddaughters. One is a Ms. Marvel fan and the other is now. For me I was hoping for something that children and adults could enjoy. But, no only kids will enjoy this silly mess.I enjoyed the Captain Marvel movie and thought the criticism was not warranted. I also loved Wanda Vision and the introduction of Monica Rambeau and I was hoping for at least a good continuation of her story. I didn't watch Ms. Marvel because I'm not a teen and I knew it wasn't for me; and after watching her parts in this movie I'm glad I stuck to that.All three actresses are good and of course Samuel L in always a pleasure to see, but none of the other characters including the so-called villain were the least bit interesting. Most of the scenes were just downright silly. I hope they continue Monica's story with better writing and I wish Marvel would stop being silly and go back to making movies for adults and kids."
"Marvels","isaacsundaralingam","11 November 2023",310,"The MCU has absolutely overstayed its welcome. Post Avengers Endgame, these projects have been feeling more and more like content than cinema (except the rare surprises like GOTG 3). Superhero fatigue, they call it and this movie does practically nothing but to amp it up to 11.You watch the trailer, you know what happens. You bet on originality, you end up homeless. There's nothing new for me to say that I haven't already said about any of the other MCU content as of late. It's so generic that I'm confident a year from now, no one would remember this movie even existed. With every new MCU project, the jokes-per-minute ratio keeps getting worse, the villains are a writer's version of a stock photograph (I can't even remember the villain's name in this movie and it hasn't even been a day since I watched it), the CGI is so out there you can almost see the CGI artists' tears on screen, and it's getting more and more difficult to tell each MCU project apart cos they're all just the same.The only few positives I can identify here are actresses Iman Vellani and Brie Larson (Larson, who seems much more relaxed and settled into her superhero boots), and maybe the flashy action sequences. Otherwise, there's nothing here to watch, nothing here to experience and nothing here to enjoy. What a shame."
