"title","username","date","stars","content"
"The Creator","poseyfan","29 September 2023",710,"This is a lesson to the movie industry on how to use a budget. 80 million dollars was used splendidly. The cinematography was amazing, (Not terribly surprising because Rogue One) acting was great, and the story was decent.It wasn't without problems though. The story moves at an increasing pace and at some points you lose track of what's happening. Suspension of disbelief will be needed in some moments.The theme of the story was to make AI to be more than just robots. I think they succeeded there, but at the expense of the humans. Most of the humans in the story ended up being one faced - except for Joshua.The dynamic between Joshua and Alfie was by far the best part of the movie. The acting was great between the two.It was a good movie. Not great by any means, but I'm all for supporting a movie that is trying something new.Overall, I think Gareth Edwards should be given some more projects. AND filmmakers everywhere should learn how a budget should be used."
"The Creator","prberg2","30 September 2023",510,"Oh, I really wanted to like this movie. Edwards did a great job with Rogue One. He missed the mark with this one. First the positives.Movie looks amazing. The world feels lived in and something that I felt was a real place. Edwards is great at world building. Actors were all pretty great.. at least with the material they were given. Sound was awesome, and it was just well made on a technical level.What didn't work for me was the story and the script. Edwards doesn't seem to have the writing skills that measure up to his strong director abilities. The story started out strong and had great potential in the first act. It was making the audience pay attention and see how it was all fitting together. The questions about AI seemed to be timely and thought provoking. Then it started to fall apart for me.It just was so flat and predictable. Didn't go to the depths that it teased that it might explore. The biggest thing for me, the massive plot holes. So annoying! For a film that seems to be trying to make a world that we could believe was real.. then the writers need to make things make sense and the characters should do things that are believable for their situations. Few examples.Joshua was trying to get Alphie back after the simulants got him. He sneaks into their area by tip toeing, and flicks a switch on the leaders neck to turn off the robot. They have their power switch right there on their necks!? None of them could detect him as he was sneaking around? After he gets Alphie back, the simulants can't find Alphie. There is no tracking capabilities on him? We can track our cell phones in this day and age, and 50 years in the future, they wouldn't be able to track their most important ""weapon/creation""? And why did they not protect their important creation. Also the Army comes in with these huge tanks (which were cool) and one explosive device completely disables it. Come on. And the flying base.. don't get me started. Joshua gets on board and destroys it so easily. The most important Army asset and it's practically defenseless. Had me rolling my eyes so many times. Making things make sense is important, especially for a film that tries to be realistic or believable. The army sends these running bombs to hurt the simulants. A missile would do the job and be so much more efficient.I also had an issue with the plot point that the AI just wanted peace and for everyone to love each other. I feel like that is a sort of weak premise. Why would the AI have that perspective? If they were based on the humans or what you would find on the internet, why would they think just loving each other would be possible. The AI wanted to survive, hense the fighting, and that idea just doesn't seem logical. At least it didn't feel believable in the world of this movie. I could not buy that idea from what was presented in the first 2 acts of the movie. I loved the questions that were brought up in the movie, but I just feel like they were not developed in a smart of thought provoking way.The movie could have been so much more. I wish it delivered for me... But I just left feeling disappointed and like the movie was an empty shell. Hopefully Edwards gets better material in the future and can bring his directing talents to material that is stronger and written in a more complete and thoughtful way."
"The Creator","BA_Harrison","27 September 2023",510,"The Terminator films warned us of the dangers of A. I., while the Spielberg/Kubrick movie A. I. painted a different picture in which robots served mankind. Gareth Edwards' The Creator gives us another take on the subject, bringing us a future where America has waged war on intelligent machines to cover up for an accidental nuclear explosion on home soil.Edwards' film tries to blend sci-fi and action with the ethical issues surrounding artificial intelligence, but in doing so it becomes something of a mess, one that clumsily combines big-budget CGI extravaganza with hamfisted morality, with intended emotionally charged scenes hampered by some truly lousy dialogue (poor Madeleine Yuna Voyles, as Alphie, is given all the worst lines -- Kami: What do you want, sweetie? Alphie: For robots to be free. Gack!).The film also doesn't make a whole lot of sense at times: I realise that the simulants are supposed to be very human-like, but did they really need to eat and drink? And cry? And why were some simulants young, and others old (one simulant is a decrepit Tibetan monk! Why would he be made like that?). And if Maya created Alphie before she got blasted into a coma, why would she have used her unborn child as the template? (to further the film's plot, of course!).It's a shame that the script isn't less problematic, because the film is amazing to look at, a triumph of special effects and incredible production design: it's the stunning visuals that helped me make it to the end.4.5/10, generously rounded up to 5 for IMDb."
"The Creator","weraqs","25 November 2023",710,"Walking into the theater, my expectations were a mix of excitement and curiosity, especially given the film's intriguing take on AI.From the get-go, ""The Creator"" impressed me with its use of the $80 million budget. The cinematography was nothing short of remarkable, reminding me of the visual flair seen in ""Blade Runner"" ""Elysium"", ""I, Robot"" and ""A. I."" The world-building was immersive, creating a believable and lived-in environment that drew me in.The performances, particularly the dynamic between Joshua and Alfie, were the highlights of the film for me. Their interactions brought depth to the story, and I found myself genuinely invested in their journey. However, as the plot progressed, I couldn't help but feel a sense of disappointment.The story, which began with promise, started to unravel. The pacing felt rushed, and the plot became increasingly predictable. I noticed glaring plot holes that were hard to overlook, and the narrative lacked the depth I had hoped for. The ambitious theme of AI's humanity, which initially seemed thought-provoking, was undermined by the film's inability to maintain coherence.While I appreciated the technical brilliance of the film, including the special effects and sound design, the script was a letdown. It was as if the movie wanted to say something profound about AI and humanity but ended up glossing over these complex themes, opting instead for a more superficial treatment.The characters, aside from Joshua, felt one-dimensional. I struggled to connect with them emotionally, this emotional disconnect was particularly evident in the portrayal of the AI characters, including Alfie, who, despite being central to the story, lacked the depth to make their plight resonate with me.While ""The Creator"" started off with great potential, it ultimately left me feeling underwhelmed. The film excelled in its visual storytelling but fell short in its narrative execution. It was a visually captivating experience, but the lack of emotional depth and narrative coherence made it a disappointing outing for me. I walked out of the theater feeling that the movie, despite its grand aspirations, missed the mark in delivering a fully engaging and thought-provoking sci-fi experience. It could have been a masterpiece, but a missed opportunity at best."
"The Creator","FeastMode","28 September 2023",410,"Sigh. As a self-proclaimed sci-fi junkie, I was looking forward to this new original stand-alone sci-fi movie. And I left fully disappointed. It's exactly like so many movies I've seen before. I basically knew how the entire movie would play out in the first five minutes.Even so, I've enjoyed plenty of movies that seem derivative. If it's done right, it can be good or even great without any originality. But everything about this movie feels off. I can see what it's trying to do. It's just not working. Character arcs and changes in perspective feel completely unearned. Emotional moments evoke no emotions.Even with all that, could I at least enjoy some cool sci-fi action? Not really. It feels mostly tame and surface-level. Part of it is the annoying limitations with PG-13 movies, avoiding all violence even with death all over the place. But it's more that the action isn't creative or... intimate? Shooting scenes are just a bunch of bullets flying everywhere (with terrible aim). And throw in explosions every now and then.People who don't watch many movies will probably enjoy it more than me. But I can't recommend this movie. It could not get me engaged or invested, which is not a difficult task for someone who loves movie as much as I do.(1 viewing, early access screening UltraScreen 9/27/2023)"
"The Creator","kgprophet","29 September 2023",510,"Many Spoilers Ahead.It seems obvious for some movies that the script writers aren't even trying to find a new approach to some of the same old tropes of your typical adventure yarn. I found that the case in the slick and enjoyable action flick ""The Gray Man"". ""Creator"" has a lot in common with a lot of mostly cliché movies. Creator and Gray Man both toss a child into the mix. You can consider her either the Chosen One or the Child Prodigy tropes. Like the baby Yoda in ""The Manchurian"". Or the chosen kid in ""The Last Airbender"". There's dozens more examples, like that annoying baby in ""Willow"". The kid is towed along through all of the adventures, and reluctantly uses his magical powers to save our protagonist from certain peril. In ""Creator"", the child prodigy's special powers are sending an electro magnetic pulse (or EMP) wave around him, rendering electronic devices powerless.The dystopian world this time is reminiscent of ""Chappie"" with a robot police force. It could also resemble ""Elysium"", where a more dominant group orbits above in a massive spaceship, sending terror to the villagers down below. The twist they try in Creator is that the villagers are androids. Well, they all look and act like regular humans, they just have a big opening in the back of their heads. Even that type of android seems cliché. The asian setting is meant to evoke images of Viet Nam when, ""Apocalypse Now""-style, U. S. Forces used advanced military equipment on mostly primitive villagers.What is also uninspiring is the Bourne-ish ""assassin turned compassionate"" trope. In fact our protagonist, named Joshua, even loses his memory after his own Bourne style mission. Another strike against is introducing the subplot while the opening act is unfolding. We are forced to try and juggle a bunch of important plot points while dodging bullets. Another hit and a miss is Joshua's wife, Maya. Within moments, they first are cuddling (with zero chemistry), then suddenly facing each other off when a conflict arises. She disappears for most of the rest of the movie. The script attaches many complicated aspects to her character, which made me go ""Huh?"" ""What?"". Ultimately the revelations about certain main characters that occur throughout the movie made me lose track of who were supposed to be the good guys and the bad guys.Part of the problem is the filmmakers jumping on the ""A. I."" bandwagon. Like Mission: Impossible: 7, the words ""Artificial Intelligence"" and ""A. I."" are sprinkled about in the dialogue, perhaps to cash in on the latest controversy involving A. I. and the threat of it taking over society (such as the Terminator franchise). Here A. I. is the perceived enemy, and has created human-like androids that I am supposed to feel compassion for, because machines are people too (like Data in the Star Trek series).This forced compassion on the main characters wasn't successful for me. In the third act, there at least a couple scenes that are shot and scored to be tearjerker moments, but fall flat. And yes, here we are with a bloated two hour and 13 minute run time, testing the patience of the audience. The story is set up in acts with title pages for each one. The slick look of this obviously expensive production looks great on the big screen, and I guess that was all I was really expecting when I went to watch it in the theatre on a rainy day.Director Gareth Edwards earned my interest by doing an excellent job making ""Rogue One: A Star Wars story"". It certainly doesn't diminish my attitude about him as a filmmaker, but I hope he learns from this experience how to better win the audience's compassion for characters. 5 out of 10."
"The Creator","Jim_Screechy","17 November 2023",510,"I watched this from start to finish without being drawn into the story at any point.I think John Washington is miscast here, I had the same exact experience when i watched Tenet... found myself very disconnected as I he didn't seem to make a proper connection with the role he was portraying.That is not to say the film isn't without issues. They have been fairly well documented by other reviewers so I'll not labour the points here.My main issue is with the lack of emotional involvment with the characters. The film measures zero on the emtional richter scale, but more, the screenplay just doesn't manage to get you excited or involved with anything that is unfolding. Additionally, the characters seem to have little connection to each other. In fact it is only at the end of the movie that Joshua and Alphie seem to have any tangible emotional cohesion.Contrast this with The Golden Child 1986 where Eddie Murphy plays Chandler Jarrell and the connection he makes to The Golden Child played by J. L. Reate. Here you can see what a great connection is established on screen and the massive difference in outcome it produces. Both films have two similar sets of pairings in almost identical scenarios with a stark contrast in outcome.Anyway, for me the film was a big dissapointment, I can't say John David Washington was the cause of this since the Movie has many other problematic aspects, but the ones I've mentioned were particularly significant for me.5/10 sadly."
"The Creator","davemanson","11 October 2023",410,"With stunning visuals reminiscent of Blade Runner and the more recent Rouge One this movie is stunning to look at. Unfortunately the script falls far short of living up to its inspired cinematography. It's full of plot holes and cringe worthy moments from it's extremely one dimensional villains. The plot twist are telegraphed from miles away and there are no real surprises to be had. Everything plays out exactly like you would expect it to. Which is a shame. The look and mood of this film is almost enough to save it. But in the end it falls flat and its potential is wasted. See it for the visuals. Forget it for its script."
"The Creator","kevin_robbins","30 September 2023",610,"My wife and I caught The Creator (2023) in theaters last night. The storyline unfolds in a futuristic society where humans and AI robots find themselves in conflict, triggered by an AI robot-initiated a nuclear attack on Los Angeles that claimed a million human lives. A man, once assigned to bring down the leader of the AI robots, experiences a devastating loss of his wife and child during an undercover mission. The government offers him a chance to complete one last mission with the promise of reuniting with his wife, and he eagerly accepts the opportunity to right past wrongs.Directed by Gareth Edwards (Rogue One: A Star Wars Story), the film stars John David Washington (Tenet), Madeleine Yuna Voyles, Gemma Chan (Eternals), Ken Watanabe (The Last Samurai), Allison Janney (The Help) and Marc Menchaca (Ozark).While the storyline bore strong resemblances to Blade Runner, unfortunately, the plot of The Creator proved to be highly predictable, with only one noteworthy twist, and I didn't find myself as invested in the characters as I had hoped. On the positive side, the acting, special effects, cinematography and settings were magnificent, but throughout the entire film, there was a sense that something crucial was missing. Additionally, the film's extended runtime led to certain sections that dragged. However, it's worth noting that the ending was satisfying, and every action scene and shootout was executed exceptionally well, making this worth your time.In conclusion, The Creator is a modernized take on the Blade Runner formula that falls short of greatness due to a missing element. I would give this a 6/10 rating and recommend seeing it once."
"The Creator","Lomax343","28 September 2023",610,"Oh dear. I was really looking forward to this, and managed to get a ticket for a pre-release showing. I left disappointed.One fact that too many film-makers have failed to grasp is that CGI alone does not make a film. Effects can make a good film better, but they can't make a mediocre film good. Marvel, I'm looking at you.It's not enough to string a few action scenes together and finish with some really big explosions. You have to have a story - preferably one that hangs together coherently. This is what's missing from this film, whose plot-holes are more pronounced than the holes where the AI characters' ears would be. Just one example - our hero is on the run in an unspecified Asian county, where it's established that he doesn't speak the language. He breaks down. A van stops, and he's asked if he needs help. Asked in perfect English. That's bad enough - but then for no explored reason, our good Samaritan progresses from giving a stranger a lift to helping him through a police road-block, risking the lives of his five children in the process.Why are there gardens on Nomad? Why, if it's the last word in military technology, is it as easy to blow up as the Death Star or a Bond Villain's lair?The child-McGuffin is portrayed by an excellent young performer, but makes no logical sense. The nuclear blast in Los Angeles (seen in the trailer, so it's not a spoiler) is cited as the reason for the war against AI. There's one throwaway line about this late in the film - but it's just that: a throw-away line. Following it up would've led to a much more interesting film.I've heard it suggested that this should be seen as a metaphor for America's involvement in Vietnam, If so, it's a tired re-hash and forty years too late. Also, that would mean regarding it as an intelligent film, which it absolutely isn'tJust one more big-budget wasted opportunity."
"The Creator","alex_with_a_P","1 October 2023",410,"AI is such a rich topic, it can be explored from any kind of angles but this movie decided to use it only as a prop. The AI people are just stand-ins for oppressed people X. None of the AI people are really intelligent, they behave as regular humans and even have to sleep (?!), which is one of many advantages machines would have over humans. The movie decides to tell a generic story that we have seen many times before, and in a better way.If one ignores the paper thin story and has to describe this movie in one word, it would be messy. Awkward change of tones, a weird plot structure with constant flashbacks, unclear action, an unlikeable protagonist that gets everyone killed and even the acting is all over the place.Similar like Neil Blomkamp, the director is more interested in world-building than in gripping storytelling. All the story beats are there, all of them predictable. Every interesting sci-fi idea is discarded in favor of a trope. You got robots who are all portrayed as inherently good (and who never malfunction) and the humans who are either evil military or grateful victims who adore their robot saviors. There are no grey areas, no ambivalent characters or ideas at play. This predictive setup reminded me a lot of the AVATAR movies. Not only do you have a protagonist who infiltrates 'the resistance' and switches sides, you got the army villain who is almost identical in behaviour and personality.The connective tissue is supposed to be the relationship between the two protagonists. If you expect them bonding slowly over the course of the 135min runtime, you should lower your expectations. Instead we get a montage in the beginning of their journey and that's pretty much all the development you'll see in that department. It's almost like the writing was a necessary evil to get from one action set piece to another.Talking about action, it is the most lifeless I have seen in a blockbuster (since the Transformers films). If the bad guys or our good guys get into a car, they get the biggest plot armour. Cars can get shot at by hundred guns or overturn a million times, they will get out of it unharmed and unphazed, even if they didn't use a seat belt. At one point it is super easy to destroy a giant tank with a small sticky charge, but once successfully applied, no one else will be using this tactic again. The Asian country where the story takes place doesn't have military or a defense budget, because they only have useless police cars/robots at their disposal whose sole purpose is to get blown up. And can we talk about explosions and how the director doesn't know how they work. Almost everyone who gets blown up by an explosion will look pretty with some bruises on their cheek, especially the women. There's also a thing called shockwave or blast radius which are the very things that will end your life. Our protagonist gets to witness three of them in point blank range. You have a person with a superpower to switch off all electronic devices, even a whole neighborhood and military checkpoint if the script wants to, but when it comes to a satellite those superpowers will only be used for a door. Almost every action scene ends with a coincidence, deus ex machina or that someone draws a gun faster than the other. The last action set piece in particular is redundant where they send a robot after someone who can turn off electric devices. Next time maybe send a monkey with a club to do the job. Mostly you'll see a hundred laser beams flying around without hitting anything or anyone. Again the action is so uninteresting that you never feel that our heroes are in danger, unless it's a side character, well then RIP, those have zero chance of survival. And why should they? They fulfilled their task of convenient exposition talk so let's just kill them to create artificial stakes. Those parts felt so nihilistic to me and more often than not sabotaged the message of the movie. The flashbacks are another thing that tell you nothing interesting. Unfortunately they are sprinkled throughout the film to make us artificially care about the protagonist. And that's what this movie is in a nutshell, a story written by an AI with some nice visual ideas but completely devoid of a soul. And I was rooting for the movie, it is no remake, has good cinematography and has good world building (only aesthetically though) but it just felt so derivative and un-engaging on an emotional level. It's a shame."
"The Creator","ethanbresnett","29 September 2023",710,"The Creator seemed to promise so much through its trailer, and although it is still a very enjoyable film it feels a little too safe and run of the mill.It's story follows the familiar tropes of humanity against AI, super weapons, chosen ones, and the reluctant guardian. None of these are overly original but they are decently executed in this film nonetheless.The emotion of the piece is a bit hit and miss. Even though the performances are good, particularly Madeleine Yuna Voyles in the role of Alfie, I just didn't really connect to any of the characters. This lack of connection and emotion is one of the biggest things missing from this film.There is no denying however that this film is beautiful. The natural landscapes are used well and the grainy camera style really adds a nice element. It also has a good score and the direction is very solid.Ultimately The Creator is a really solid sci-fi film, but it just feels a little safe and derivative. Perhaps my expectations were too high as the trailer suggested this was potential a more high concept and emotionally gripping sci-fi, when I don't think that is the case. Still a good film though."
