"title","username","date","stars","content"
"The Creator","benjaminskylerhill","28 September 2023",910,"Gareth Edwards proves himself to be an astoundingly brilliant director with The Creator, as he crafts a visual and auditory world rich with layers of detail, and characters that we quickly understand and naturally grow over the course of the story.He made an $80 million movie that looks like it cost at least twice that. This cost less than half of what Thor: Love and Thunder cost. Let that sink in.Edwards shows he's a better director than writer, as the film is far from original, borrowing concepts and themes from plenty of old classic sci-fi stories. And it's also burdened with some clunky dialogue and rushed, convenient crucial plot points.Yeah, it's imperfect. But it's made with a confidence and care that goes beyond the degree of admirable. It's an earnest expression of love, redemption, sacrifice, and forgiveness put out by a filmmaker who really cares for the characters whose story he's telling.It's a work of art that, even with its flaws, deserves to be seen."
"The Creator","FixedYourEnding","17 November 2023",410,"This is going to be an unpopular review, I know. Maybe I was in the wrong mood coming into this movie, but I turned it off after 25 minutes, couldn't stand it anymore. The whole premise of American white males are constant war-mongers and do not understand progress. If you are an African American you *might* be ok, it helps if you are hurt or imperfect in some other way, if you are a minority then you should be protected and saved, etc etc.The story as a whole makes little sense and it is remains incoherent with empty dialogues and mediocre acting. Why bombs, why the war, it is not explained and when those questions are asked they reply is some sort of a joke, such as ""they are here for our jobs"". Also not explained why would someone remove his prosthetic arm before going to the pool but not his leg. Whatever.The only redeemable quality for this movie is the production value and the almost next-gen gaming-like scenario and photography. I guess if you can ignore everything else, and just look at the imagery you might enjoy it. I personally needed a little more, or actually quite a lot more.This is another polarizing creation. I fell on the ""don't like it"" side, two thumbs down for me. Looks like writers were on strike but CGI was on sale. Exact score: 44 / 100."
"The Creator","masonsaul","28 September 2023",810,"The Creator is an all too rare piece of original epic sci-fi that's built on very familiar foundations and uses them to create something that's as visually exciting as it is emotionally investing, completely unafraid to show American military might for the soulless monster it is.John David Washington plays his reluctant father figure in terrific fashion, closed off at first but those barriers are all successfully worn down by the end. In her screen debut Madeleine Yuna Voyles is amazing, adorable and undoubtedly the main reason any of this works on an emotional level.Supporting them is Ken Watanabe being as effortlessly stoic as always and Allison Janney as an antagonist with a solid amount of depth all thanks to just one scene which efficiently explains her viewpoint in a believable fashion but she's also just plain ruthless in her relentless pursuit.Gareth Edwards once again proves he doesn't need established franchises to create epic imagery or fascinating worlds on a blockbuster scale. Between the stunning cinematography by Greig Fraser & Oren Soffer and the ridiculously impressive CG it outdoes the majority of the competition on a fraction of the cost.Uncharacteristically for Gareth Edwards there's a fair few needle drops early on, the choices can be obvious but always effective and the music by Hans Zimmer is solid. It's mostly just fine up until the third act where it really comes to life and avoids feeling wasted."
"The Creator","CANpatbuck3664","20 October 2023",710,"Starting my review of the creator with some comments on the acting, I'm surprised at how meteoric John David Washington's rise to the top has been. He's a good actor for sure but he's not just ascending the staircase, he's jumping a few steps at a time. He's anchoring the Creator as our protagonist Joshua. I think he's good in the movie, he's brooding for what feels like most of the run time but when he's given a chance to either be funny in short bursts or vulnerable near the end, he gets the job done. Madeleine Yuna Voyles is fine as Alphie, she accomplishes what's required in any given scene and by the end of the movie, she does what she can in regards to selling the bond her character has with Joshua. It's hard to deliver a noteworthy performance as a child actor/actress and she's better than passable. I keep waiting for the Gemma Chan's breakout role but this is one of her better performances as Maya. She has chemistry with Washington but she's given little to do on her own. She's appropriately cast and she sticks the landing in her part. My two favourite performances were from the veteran members of the supporting cast in Ken Watanabe and Allison Janney as Harun and Colonel Howell respectively. Janney pushes the envelope just far enough without descending into being a cartoon character, her character's palpable hatred for the Simulants creates tension and the amount of disdain she conveys through just a look is impressive. Watanabe brings strength to Harun when he needs to but there's also a lot of warmth when his character is bonding with Alphie.Despite some solid work from the cast overall, I'd bet what's probably going to draw your attention in the marketing material for The Creator is the design of this dystopian world and how the war between humans and A. I. dazzles on the big screen. Gareth Edwards and his team weren't working with pennies but this is as impressive of a display for a science fiction movie that I've seen in quite a while. The cinematography is fantastic, the character design of the robots evoked Neil Blomkamp's work for me in the best way without ripping it off and the action set pieces are memorable enough to hold your interest. The movie is just as fantastical (or grounded depending on your opinion on the future of artificial intelligence) as any other sci-fi epic, but there's a beautiful mix of real imagination that keeps the movie grounded just enough that you can still take it seriously. I found it disarming that it was so excellently realized and even if you aren't enthralled by the story, The Creator is still a delight from a visual perspective.I would describe The Creator as story driven as opposed to character driven but we spend enough time with Joshua, Alphie and their friends and enemies to get to know them. I liked the work done on the characters but I wasn't emotionally invested in whether Josh and Maya were going to reunite or if Alphie would make it away safely. I don't want to point the finger at the scriptwriters or the creative team, I was left wondering how much of this movie had been cut out and left on the cutting room floor. Scenes normally required to get us to invest in some of these relationships (e.g. Josh & Alfie, Josh & Shipley or Colonel Howell & McBride) felt like they were missing to me. I don't want to complain about the run time because The Creator isn't a short movie but I was left wondering if they cleaved off a little more than they should have.My most prominent problem with The Creator was how easy to guess the overall arc of the plot was. I didn't discern what it was going to do minute by minute but you can get where the story will start, advance to and finish largely from the trailer. There are some surprises here and there but if you zoom out and observe the macro progression of the plot, this ground has been covered before. Cliche seems a little harsh of a description but The Creator still lacks something bold in where it decides to venture and I was a little disappointed by that.The Creator really falls between a 7-8 for me but this is one of the rare situations where I'm going to round down. The film is still a spectacle and if you can get over that the plot is a little recycled in certain respects, there's a lot here to enjoy. Gareth Edwards and his team deserve kudos for making The Creator a worthy theatre experience. But I still wasn't blown-away by this movie and I wanted it to really kick into the next gear to get past the 8/10 mark. The Creator is a solid science fiction adventure that is worth checking out on the biggest screen you can but outside of it's CGI and visual sensibilities, I don't think it will have the staying power to make the huge impact it's clearly swinging for."
"The Creator","Imshortok06","30 September 2023",510,"You know a movie is bad when you take your Asian immigrant dad to go watch it with you and the first thing he says after watching it is ""Okay, which communist wrote this?!"" The movie's message seemed to be America: bad; military: bad; Asia: good. And there didn't seem to be any compelling reason to root for the robots other than the fact that the kid was cute and the other AI were poor villagers. It seems to me that in order for a movie to be good, the message should be complex and universally compelling. I didn't get what the message was, other than what I previously stated. Literally every bad guy was white and American. It's either very biased or very patronizing. On the other hand, I did think the actors did a good job, and the cinematography was outstanding."
"The Creator","DanTheMan2150AD","28 September 2023",710,"7 years on from his last big screen venture with the phenomenal Rogue One, The Creator isn't quite the comeback I had hoped for director Gareth Edwards. Visually, it's stunning with all of Edwards' 1980s science fiction influences on full display, but it often feels conflicted in tone and the subject matter it's trying to tackle, especially in today's world. Edwards pushes the relatable ordinariness of the androids and hybrid ""simulants"", but the potential menace of A. I. inescapably looms over the movie's head. For all its spectacular set pieces, detailed depth in its design and jaw-dropping imagery, the writing pulls the rug out from what could have been a modern sci-fi classic."
"The Creator","TheVictoriousV","1 October 2023",510,"When the trailer for The Creator came out, I basically became a Facebook Disney fangirl but, like, the opposite.I was all ""OMGOMG it's a big Hollywood sci-fi movie but, like, it's made by a director with a voice and... Get this... it's based on ABSOLUTELY NOTHING! No really, they FINALLY remade/rebooted/did a sequel to NOT A DAMN THING!! OMGOMG, I've waited my whole life for originality! TAG A FRIEND YOU HAVE TO SEE THIS WITH!""Be that as it may, the film as such is kind of dull and, despite not being based on anything specific, has its share of clichés and ideas that seem borrowed from prior works of sci-fi. It has the strengths we've come to expect from Gareth Edwards (few directors achieve a sense of scale quite like he does; we feel humbled by his versions of Godzilla and the Death Star in a way that we hadn't before) but also exemplifies his weakness when it comes to creating gripping characters.Still, it's hard not to appreciate the movie on some level. Edwards' vision is very much on the screen; it's just that his influences were either too obvious or distracting -- in the sense that they reminded me of more captivating stories I could be watching instead. (Quoth Joe Bro on Twitter, this movie will be ""huge for people who never heard of Akira, or Blade Runner, or The Last of Us, or 9/11.)Regardless, I'm happy I gave it a shot. Some of these images are worthy of the pages of Simon Stålenhag.Here's hoping Edwards someday adapts some of his tales."
"The Creator","poseyfan","29 September 2023",710,"This is a lesson to the movie industry on how to use a budget. 80 million dollars was used splendidly. The cinematography was amazing, (Not terribly surprising because Rogue One) acting was great, and the story was decent.It wasn't without problems though. The story moves at an increasing pace and at some points you lose track of what's happening. Suspension of disbelief will be needed in some moments.The theme of the story was to make AI to be more than just robots. I think they succeeded there, but at the expense of the humans. Most of the humans in the story ended up being one faced - except for Joshua.The dynamic between Joshua and Alfie was by far the best part of the movie. The acting was great between the two.It was a good movie. Not great by any means, but I'm all for supporting a movie that is trying something new.Overall, I think Gareth Edwards should be given some more projects. AND filmmakers everywhere should learn how a budget should be used."
"The Creator","prberg2","30 September 2023",510,"Oh, I really wanted to like this movie. Edwards did a great job with Rogue One. He missed the mark with this one. First the positives.Movie looks amazing. The world feels lived in and something that I felt was a real place. Edwards is great at world building. Actors were all pretty great.. at least with the material they were given. Sound was awesome, and it was just well made on a technical level.What didn't work for me was the story and the script. Edwards doesn't seem to have the writing skills that measure up to his strong director abilities. The story started out strong and had great potential in the first act. It was making the audience pay attention and see how it was all fitting together. The questions about AI seemed to be timely and thought provoking. Then it started to fall apart for me.It just was so flat and predictable. Didn't go to the depths that it teased that it might explore. The biggest thing for me, the massive plot holes. So annoying! For a film that seems to be trying to make a world that we could believe was real.. then the writers need to make things make sense and the characters should do things that are believable for their situations. Few examples.Joshua was trying to get Alphie back after the simulants got him. He sneaks into their area by tip toeing, and flicks a switch on the leaders neck to turn off the robot. They have their power switch right there on their necks!? None of them could detect him as he was sneaking around? After he gets Alphie back, the simulants can't find Alphie. There is no tracking capabilities on him? We can track our cell phones in this day and age, and 50 years in the future, they wouldn't be able to track their most important ""weapon/creation""? And why did they not protect their important creation. Also the Army comes in with these huge tanks (which were cool) and one explosive device completely disables it. Come on. And the flying base.. don't get me started. Joshua gets on board and destroys it so easily. The most important Army asset and it's practically defenseless. Had me rolling my eyes so many times. Making things make sense is important, especially for a film that tries to be realistic or believable. The army sends these running bombs to hurt the simulants. A missile would do the job and be so much more efficient.I also had an issue with the plot point that the AI just wanted peace and for everyone to love each other. I feel like that is a sort of weak premise. Why would the AI have that perspective? If they were based on the humans or what you would find on the internet, why would they think just loving each other would be possible. The AI wanted to survive, hense the fighting, and that idea just doesn't seem logical. At least it didn't feel believable in the world of this movie. I could not buy that idea from what was presented in the first 2 acts of the movie. I loved the questions that were brought up in the movie, but I just feel like they were not developed in a smart of thought provoking way.The movie could have been so much more. I wish it delivered for me... But I just left feeling disappointed and like the movie was an empty shell. Hopefully Edwards gets better material in the future and can bring his directing talents to material that is stronger and written in a more complete and thoughtful way."
"The Creator","BA_Harrison","27 September 2023",510,"The Terminator films warned us of the dangers of A. I., while the Spielberg/Kubrick movie A. I. painted a different picture in which robots served mankind. Gareth Edwards' The Creator gives us another take on the subject, bringing us a future where America has waged war on intelligent machines to cover up for an accidental nuclear explosion on home soil.Edwards' film tries to blend sci-fi and action with the ethical issues surrounding artificial intelligence, but in doing so it becomes something of a mess, one that clumsily combines big-budget CGI extravaganza with hamfisted morality, with intended emotionally charged scenes hampered by some truly lousy dialogue (poor Madeleine Yuna Voyles, as Alphie, is given all the worst lines -- Kami: What do you want, sweetie? Alphie: For robots to be free. Gack!).The film also doesn't make a whole lot of sense at times: I realise that the simulants are supposed to be very human-like, but did they really need to eat and drink? And cry? And why were some simulants young, and others old (one simulant is a decrepit Tibetan monk! Why would he be made like that?). And if Maya created Alphie before she got blasted into a coma, why would she have used her unborn child as the template? (to further the film's plot, of course!).It's a shame that the script isn't less problematic, because the film is amazing to look at, a triumph of special effects and incredible production design: it's the stunning visuals that helped me make it to the end.4.5/10, generously rounded up to 5 for IMDb."
"The Creator","weraqs","25 November 2023",710,"Walking into the theater, my expectations were a mix of excitement and curiosity, especially given the film's intriguing take on AI.From the get-go, ""The Creator"" impressed me with its use of the $80 million budget. The cinematography was nothing short of remarkable, reminding me of the visual flair seen in ""Blade Runner"" ""Elysium"", ""I, Robot"" and ""A. I."" The world-building was immersive, creating a believable and lived-in environment that drew me in.The performances, particularly the dynamic between Joshua and Alfie, were the highlights of the film for me. Their interactions brought depth to the story, and I found myself genuinely invested in their journey. However, as the plot progressed, I couldn't help but feel a sense of disappointment.The story, which began with promise, started to unravel. The pacing felt rushed, and the plot became increasingly predictable. I noticed glaring plot holes that were hard to overlook, and the narrative lacked the depth I had hoped for. The ambitious theme of AI's humanity, which initially seemed thought-provoking, was undermined by the film's inability to maintain coherence.While I appreciated the technical brilliance of the film, including the special effects and sound design, the script was a letdown. It was as if the movie wanted to say something profound about AI and humanity but ended up glossing over these complex themes, opting instead for a more superficial treatment.The characters, aside from Joshua, felt one-dimensional. I struggled to connect with them emotionally, this emotional disconnect was particularly evident in the portrayal of the AI characters, including Alfie, who, despite being central to the story, lacked the depth to make their plight resonate with me.While ""The Creator"" started off with great potential, it ultimately left me feeling underwhelmed. The film excelled in its visual storytelling but fell short in its narrative execution. It was a visually captivating experience, but the lack of emotional depth and narrative coherence made it a disappointing outing for me. I walked out of the theater feeling that the movie, despite its grand aspirations, missed the mark in delivering a fully engaging and thought-provoking sci-fi experience. It could have been a masterpiece, but a missed opportunity at best."
"The Creator","FeastMode","28 September 2023",410,"Sigh. As a self-proclaimed sci-fi junkie, I was looking forward to this new original stand-alone sci-fi movie. And I left fully disappointed. It's exactly like so many movies I've seen before. I basically knew how the entire movie would play out in the first five minutes.Even so, I've enjoyed plenty of movies that seem derivative. If it's done right, it can be good or even great without any originality. But everything about this movie feels off. I can see what it's trying to do. It's just not working. Character arcs and changes in perspective feel completely unearned. Emotional moments evoke no emotions.Even with all that, could I at least enjoy some cool sci-fi action? Not really. It feels mostly tame and surface-level. Part of it is the annoying limitations with PG-13 movies, avoiding all violence even with death all over the place. But it's more that the action isn't creative or... intimate? Shooting scenes are just a bunch of bullets flying everywhere (with terrible aim). And throw in explosions every now and then.People who don't watch many movies will probably enjoy it more than me. But I can't recommend this movie. It could not get me engaged or invested, which is not a difficult task for someone who loves movie as much as I do.(1 viewing, early access screening UltraScreen 9/27/2023)"
"The Creator","kgprophet","29 September 2023",510,"Many Spoilers Ahead.It seems obvious for some movies that the script writers aren't even trying to find a new approach to some of the same old tropes of your typical adventure yarn. I found that the case in the slick and enjoyable action flick ""The Gray Man"". ""Creator"" has a lot in common with a lot of mostly cliché movies. Creator and Gray Man both toss a child into the mix. You can consider her either the Chosen One or the Child Prodigy tropes. Like the baby Yoda in ""The Manchurian"". Or the chosen kid in ""The Last Airbender"". There's dozens more examples, like that annoying baby in ""Willow"". The kid is towed along through all of the adventures, and reluctantly uses his magical powers to save our protagonist from certain peril. In ""Creator"", the child prodigy's special powers are sending an electro magnetic pulse (or EMP) wave around him, rendering electronic devices powerless.The dystopian world this time is reminiscent of ""Chappie"" with a robot police force. It could also resemble ""Elysium"", where a more dominant group orbits above in a massive spaceship, sending terror to the villagers down below. The twist they try in Creator is that the villagers are androids. Well, they all look and act like regular humans, they just have a big opening in the back of their heads. Even that type of android seems cliché. The asian setting is meant to evoke images of Viet Nam when, ""Apocalypse Now""-style, U. S. Forces used advanced military equipment on mostly primitive villagers.What is also uninspiring is the Bourne-ish ""assassin turned compassionate"" trope. In fact our protagonist, named Joshua, even loses his memory after his own Bourne style mission. Another strike against is introducing the subplot while the opening act is unfolding. We are forced to try and juggle a bunch of important plot points while dodging bullets. Another hit and a miss is Joshua's wife, Maya. Within moments, they first are cuddling (with zero chemistry), then suddenly facing each other off when a conflict arises. She disappears for most of the rest of the movie. The script attaches many complicated aspects to her character, which made me go ""Huh?"" ""What?"". Ultimately the revelations about certain main characters that occur throughout the movie made me lose track of who were supposed to be the good guys and the bad guys.Part of the problem is the filmmakers jumping on the ""A. I."" bandwagon. Like Mission: Impossible: 7, the words ""Artificial Intelligence"" and ""A. I."" are sprinkled about in the dialogue, perhaps to cash in on the latest controversy involving A. I. and the threat of it taking over society (such as the Terminator franchise). Here A. I. is the perceived enemy, and has created human-like androids that I am supposed to feel compassion for, because machines are people too (like Data in the Star Trek series).This forced compassion on the main characters wasn't successful for me. In the third act, there at least a couple scenes that are shot and scored to be tearjerker moments, but fall flat. And yes, here we are with a bloated two hour and 13 minute run time, testing the patience of the audience. The story is set up in acts with title pages for each one. The slick look of this obviously expensive production looks great on the big screen, and I guess that was all I was really expecting when I went to watch it in the theatre on a rainy day.Director Gareth Edwards earned my interest by doing an excellent job making ""Rogue One: A Star Wars story"". It certainly doesn't diminish my attitude about him as a filmmaker, but I hope he learns from this experience how to better win the audience's compassion for characters. 5 out of 10."
